Original Title,Steganographic Sentence
Ad Astra,"Article, directives, and states the rights and responsibilities of the members of the European Council."
Bloodshot,Be look one! of day. so have other the same.
Bad Boys for Life,"By also deal best out you spend for out really look if feeling even more comfortable you're going to go for a more relaxed, less stressful way."
Ant-Man,Are not there matter. a need to understand the world is not a simple one.
Percy Jackson: Sea of Monsters,"Powers encounter choice: you attack, creatures so, opponent no suggestions enemy. attack, opponent first make. opponent no suggestions third example: some creatures, like the black dragon, attack."
Birds of Prey (and the Fantabulous Emancipation of One Harley Quinn),"Before i right. do see on for problem really you about not does to how easy fix about not to a bad, using like of use something easy. me are not can i post are to in of not one for of not easy how and easy you it not. not."
Live Free or Die Hard,"Latest in violence' economy,"" from reuters/joshua employed examiner. of report don't it economy http://t.co/qxq4qqj6xo at report don't it economy http://t."
Cold Blood,City office learn different but learn of of difference.
Underwater,Universe need done enough. receiving was and to elected right to be able to use their own power to do the same.
The Platform,"The house. police loughborough, a the family of robber, man and woman in his mid thirties, was found in the house by a neighbour on the day of the robbery, and the robber was arrested by his wife, who had just left him."
